{
  "schema": "group-e-manifest/v1",
  "group_id": "agent-workflows.group.E",
  "implementation_kind": "skill",
  "contracts": [
    {"qualified_id":"group.E.E1","local_id":"E1","status":"candidate-source","source_ref":{"path":"agent-workflows/skills/execution-preflight/SKILL.md","digest":"sha256:9f78260ca8cb60dbce4953d9b0bbfd242d55bba1dac276e0f4866fbbe8552aaa"},"selector_ref":{"path":"agent-workflows/src/ai_agent_workflow/execution_group.py","digest":"sha256:745c63fd8ca761148b91d116549a71bb140d02e65ada39b8a1148e67abaeba9a","selector":"ExecutionGroupV1.compile(group.E.E1)"},"receipt_ref":{"path":"agent-workflows/evidence/contracts/E1.json","digest":"sha256:4a8a5efec0f374bba713565eafbe1c34c91d6f3030c9b868e802a3016f9fa08a"}},
    {"qualified_id":"group.E.E2","local_id":"E2","status":"candidate-source","source_ref":{"path":"agent-workflows/skills/dispatch-task/SKILL.md","digest":"sha256:15d5d8069f44150d4bdd85bdd050b4618bc63b0215abd9f793285d90450d4417"},"selector_ref":{"path":"agent-workflows/src/ai_agent_workflow/execution_group.py","digest":"sha256:745c63fd8ca761148b91d116549a71bb140d02e65ada39b8a1148e67abaeba9a","selector":"ExecutionGroupV1.compile(group.E.E2)"},"receipt_ref":{"path":"agent-workflows/evidence/contracts/E2.json","digest":"sha256:5f8ba82cdb6a6225ac820f8acb4002e47afda20c4ce6fd46db07c249d8d71106"}},
    {"qualified_id":"group.E.E3","local_id":"E3","status":"candidate-source","source_ref":{"path":"agent-workflows/skills/execute-small-loop/SKILL.md","digest":"sha256:c17951bf7653b0a58f0232e451b26371beec7c68da65d2114faf93c999bb66bb"},"selector_ref":{"path":"agent-workflows/src/ai_agent_workflow/execution_group.py","digest":"sha256:745c63fd8ca761148b91d116549a71bb140d02e65ada39b8a1148e67abaeba9a","selector":"ExecutionGroupV1.compile(group.E.E3)"},"receipt_ref":{"path":"agent-workflows/evidence/contracts/E3.json","digest":"sha256:561373bb21fd926cbdd2b540d93268e72758c96c7cdb8c7515c54775d87b9c04"}},
    {"qualified_id":"group.E.E4","local_id":"E4","status":"candidate-source","source_ref":{"path":"agent-workflows/skills/review-task-spec/SKILL.md","digest":"sha256:76eff0d75cfaba8cbe1d8ef4f3ef2f727fe3d71b5ad8a0d644455fe6bf0fdbf5"},"selector_ref":{"path":"agent-workflows/src/ai_agent_workflow/execution_group.py","digest":"sha256:745c63fd8ca761148b91d116549a71bb140d02e65ada39b8a1148e67abaeba9a","selector":"ExecutionGroupV1.compile(group.E.E4)"},"receipt_ref":{"path":"agent-workflows/evidence/contracts/E4.json","digest":"sha256:79793b3302aa9d90c589f336a1ce7ff435234c7a8e32541ff8ed5c45674bb2bf"}},
    {"qualified_id":"group.E.E5","local_id":"E5","status":"candidate-source","source_ref":{"path":"agent-workflows/skills/review-task-quality/SKILL.md","digest":"sha256:1c3388df90da7431a6027e8bd7a8b6430b79d77ae5fd21e55905379b864b5816"},"selector_ref":{"path":"agent-workflows/src/ai_agent_workflow/execution_group.py","digest":"sha256:745c63fd8ca761148b91d116549a71bb140d02e65ada39b8a1148e67abaeba9a","selector":"ExecutionGroupV1.compile(group.E.E5)"},"receipt_ref":{"path":"agent-workflows/evidence/contracts/E5.json","digest":"sha256:0700d2b450e9dd5181714462e17098fb29bdb85e3021d3d8f849ec3d79bc9cc6"}},
    {"qualified_id":"group.E.E6","local_id":"E6","status":"candidate-source","source_ref":{"path":"agent-workflows/skills/validate-review-findings/SKILL.md","digest":"sha256:c847b700a877f9188cb5748edf8a18e2fe094193ac629ec16e45ffa960f70833"},"selector_ref":{"path":"agent-workflows/src/ai_agent_workflow/execution_group.py","digest":"sha256:745c63fd8ca761148b91d116549a71bb140d02e65ada39b8a1148e67abaeba9a","selector":"ExecutionGroupV1.compile(group.E.E6)"},"receipt_ref":{"path":"agent-workflows/evidence/contracts/E6.json","digest":"sha256:70823858ca42338054b10cbd96ea063081632d44a491cf16d623071dd086f32d"}},
    {"qualified_id":"group.E.E7","local_id":"E7","status":"candidate-source","source_ref":{"path":"agent-workflows/skills/fix-and-rereview/SKILL.md","digest":"sha256:ccee1d9f0dea5807acd5620594aee73bade25a447736cd14b2d0a09dba25d2fd"},"selector_ref":{"path":"agent-workflows/src/ai_agent_workflow/execution_group.py","digest":"sha256:745c63fd8ca761148b91d116549a71bb140d02e65ada39b8a1148e67abaeba9a","selector":"ExecutionGroupV1.compile(group.E.E7)"},"receipt_ref":{"path":"agent-workflows/evidence/contracts/E7.json","digest":"sha256:57af72ddfb837167ee047f8fd4494e70cad856be29064417482c4638ae97c99a"}},
    {"qualified_id":"group.E.E8","local_id":"E8","status":"candidate-source","source_ref":{"path":"agent-workflows/skills/converge-parallel-batch/SKILL.md","digest":"sha256:c7a7b7e30cb16dd690571bdd1c2916e64fdd18f3a1e33152ecd5eb4e6fefc72c"},"selector_ref":{"path":"agent-workflows/src/ai_agent_workflow/execution_group.py","digest":"sha256:745c63fd8ca761148b91d116549a71bb140d02e65ada39b8a1148e67abaeba9a","selector":"ExecutionGroupV1.compile(group.E.E8)"},"receipt_ref":{"path":"agent-workflows/evidence/contracts/E8.json","digest":"sha256:98c47e6e08a32aad431330aed1d5031415051c38ed3aa1ceb780a29fcf532d7b"}},
    {"qualified_id":"group.E.E9","local_id":"E9","status":"candidate-source","source_ref":{"path":"agent-workflows/skills/verify-whole-change/SKILL.md","digest":"sha256:1e0eaf88f7d969ad230f7dc55d529e05ac031dd36b1dfe4ab85ac959ec1d59d9"},"selector_ref":{"path":"agent-workflows/src/ai_agent_workflow/execution_group.py","digest":"sha256:745c63fd8ca761148b91d116549a71bb140d02e65ada39b8a1148e67abaeba9a","selector":"ExecutionGroupV1.compile(group.E.E9)"},"receipt_ref":{"path":"agent-workflows/evidence/contracts/E9.json","digest":"sha256:4cf5f77938ab4f37cf0f0428f4a571e3d877bb10675c5ac9ab6adf37c0177853"}},
    {"qualified_id":"group.E.E10","local_id":"E10","status":"candidate-source","source_ref":{"path":"agent-workflows/skills/arbitrate-exception/SKILL.md","digest":"sha256:9701dbb8041fb1e51d94916dba127191d5fc374eb122187ed0f90023667caf46"},"selector_ref":{"path":"agent-workflows/src/ai_agent_workflow/execution_group.py","digest":"sha256:745c63fd8ca761148b91d116549a71bb140d02e65ada39b8a1148e67abaeba9a","selector":"ExecutionGroupV1.compile(group.E.E10)"},"receipt_ref":{"path":"agent-workflows/evidence/contracts/E10.json","digest":"sha256:6b8e84db5d88e613f67ab1682937d3d51c1aae3324d9ea4ed47f34bc240e9493"}}
  ]
}
